{
 "bnapCases": 1,
 "area": "pricing",
 "title": "Pricing, admission and metering",
 "schema": "schema/pricing.schema.json",
 "generator": "conformance/gen_cases.py",
 "source": "spec/socket-draft-00.md (doc rev 39), spec/ERRATA.md, spec/DECISIONS.md, registry/generated/registry.json, reference/python/bnap_ref.py",
 "numberOfTests": 47,
 "header": [
  "price() and admit of draft-00 section 7, in offer order. Each attestation lists whether it",
  "verified and, for a quota, whether its counter has room. Admission for a credential without",
  "pay prices from any positive base (see the NoPayBase note): only a waive, a 10,000 bp discount",
  "or a quota with room bring it to 0. Class None value schemes are admissible only at price 0",
  "(DECISIONS row 25)."
 ],
 "notes": {
  "Valid": {
   "bugType": "BASIC",
   "description": "A well-formed input every implementation must accept."
  },
  "Multiply": {
   "bugType": "BASIC",
   "description": "Discounts multiply and each step rounds the amount taken off down."
  },
  "OrderMatters": {
   "bugType": "EDGE",
   "description": "Rounding makes the result depend on order: the offer's order rules."
  },
  "Quota": {
   "bugType": "BASIC",
   "description": "A quota applies only while p > 0, the first verified one with room."
  },
  "Policy": {
   "bugType": "POLICY",
   "description": "A required attestation did not verify."
  },
  "Underpaid": {
   "bugType": "UNDERPAID",
   "description": "Value below the effective price."
  },
  "NoPayBase": {
   "bugType": "EDGE",
   "description": "draft-00 7 writes price(entry.amount, or 0 if the credential has no pay), which makes its own 'p > 0 and no pay' check unreachable and would admit any attestation-only credential for free. These cases price a credential without pay from a positive base; a waive, a 10,000 bp discount or a quota with room admit it, nothing else does. Reported as an erratum candidate."
  },
  "Overpayment": {
   "bugType": "BASIC",
   "description": "Value above the price is admitted; a scheme that can return change does."
  },
  "Metering": {
   "bugType": "BASIC",
   "description": "charged = min(price(ceil(units x rate / 1000)), price(amount)), exactly."
  },
  "ClassRule": {
   "bugType": "MALFORMED",
   "description": "An offer no gate may build."
  }
 },
 "testGroups": [
  {
   "type": "Price",
   "section": "7",
   "description": "price(base) over the attestations in offer order.",
   "tests": [
    {
     "tcId": 1,
     "comment": "no attestations",
     "flags": [
      "Valid"
     ],
     "sections": [
      "7"
     ],
     "inputs": {
      "base": 2100,
      "attests": []
     },
     "result": "valid",
     "expected": {
      "price": 2100,
      "quota_index": null
     }
    },
    {
     "tcId": 2,
     "comment": "a verified waive",
     "flags": [
      "Valid"
     ],
     "sections": [
      "7"
     ],
     "inputs": {
      "base": 2100,
      "attests": [
       {
        "scheme": "httpauth:DPoP",
        "effect": "waive",
        "verified": true,
        "class": "A"
       }
      ]
     },
     "result": "valid",
     "expected": {
      "price": 0,
      "quota_index": null
     }
    },
    {
     "tcId": 3,
     "comment": "a waive that did not verify",
     "flags": [
      "Valid"
     ],
     "sections": [
      "7"
     ],
     "inputs": {
      "base": 2100,
      "attests": [
       {
        "scheme": "httpauth:DPoP",
        "effect": "waive",
        "verified": false,
        "class": "A"
       }
      ]
     },
     "result": "valid",
     "expected": {
      "price": 2100,
      "quota_index": null
     }
    },
    {
     "tcId": 4,
     "comment": "one 20% discount (draft-00 10.3)",
     "flags": [
      "Valid"
     ],
     "sections": [
      "7"
     ],
     "inputs": {
      "base": 2100,
      "attests": [
       {
        "scheme": "httpsig:web-bot-auth",
        "effect": "discount",
        "verified": true,
        "class": "A",
        "value": 2000
       }
      ]
     },
     "result": "valid",
     "expected": {
      "price": 1680,
      "quota_index": null
     }
    },
    {
     "tcId": 5,
     "comment": "two 20% discounts multiply: 36% off, never 40%",
     "flags": [
      "Multiply"
     ],
     "sections": [
      "7"
     ],
     "inputs": {
      "base": 2100,
      "attests": [
       {
        "scheme": "httpsig:web-bot-auth",
        "effect": "discount",
        "verified": true,
        "class": "A",
        "value": 2000
       },
       {
        "scheme": "nip:98",
        "effect": "discount",
        "verified": true,
        "class": "A",
        "value": 2000
       }
      ]
     },
     "result": "valid",
     "expected": {
      "price": 1344,
      "quota_index": null
     }
    },
    {
     "tcId": 6,
     "comment": "base 5: 3,333 bp then 5,001 bp",
     "flags": [
      "OrderMatters"
     ],
     "sections": [
      "7"
     ],
     "inputs": {
      "base": 5,
      "attests": [
       {
        "scheme": "httpsig:web-bot-auth",
        "effect": "discount",
        "verified": true,
        "class": "A",
        "value": 3333
       },
       {
        "scheme": "nip:98",
        "effect": "discount",
        "verified": true,
        "class": "A",
        "value": 5001
       }
      ]
     },
     "result": "valid",
     "expected": {
      "price": 2,
      "quota_index": null
     }
    },
    {
     "tcId": 7,
     "comment": "base 5: 5,001 bp then 3,333 bp",
     "flags": [
      "OrderMatters"
     ],
     "sections": [
      "7"
     ],
     "inputs": {
      "base": 5,
      "attests": [
       {
        "scheme": "nip:98",
        "effect": "discount",
        "verified": true,
        "class": "A",
        "value": 5001
       },
       {
        "scheme": "httpsig:web-bot-auth",
        "effect": "discount",
        "verified": true,
        "class": "A",
        "value": 3333
       }
      ]
     },
     "result": "valid",
     "expected": {
      "price": 3,
      "quota_index": null
     }
    },
    {
     "tcId": 8,
     "comment": "a 10,000 bp discount",
     "flags": [
      "Valid"
     ],
     "sections": [
      "7"
     ],
     "inputs": {
      "base": 2100,
      "attests": [
       {
        "scheme": "httpsig:web-bot-auth",
        "effect": "discount",
        "verified": true,
        "class": "A",
        "value": 10000
       }
      ]
     },
     "result": "valid",
     "expected": {
      "price": 0,
      "quota_index": null
     }
    },
    {
     "tcId": 9,
     "comment": "rounding: 999 with 3,333 bp takes off 332",
     "flags": [
      "Multiply"
     ],
     "sections": [
      "7"
     ],
     "inputs": {
      "base": 999,
      "attests": [
       {
        "scheme": "httpsig:web-bot-auth",
        "effect": "discount",
        "verified": true,
        "class": "A",
        "value": 3333
       }
      ]
     },
     "result": "valid",
     "expected": {
      "price": 667,
      "quota_index": null
     }
    },
    {
     "tcId": 10,
     "comment": "a discount that did not verify has no effect",
     "flags": [
      "Valid"
     ],
     "sections": [
      "7"
     ],
     "inputs": {
      "base": 2100,
      "attests": [
       {
        "scheme": "httpsig:web-bot-auth",
        "effect": "discount",
        "verified": false,
        "class": "A",
        "value": 2000
       }
      ]
     },
     "result": "valid",
     "expected": {
      "price": 2100,
      "quota_index": null
     }
    },
    {
     "tcId": 11,
     "comment": "a quota with room",
     "flags": [
      "Quota"
     ],
     "sections": [
      "7"
     ],
     "inputs": {
      "base": 2100,
      "attests": [
       {
        "scheme": "httpauth:DPoP",
        "effect": "quota",
        "verified": true,
        "class": "A",
        "value": 5,
        "epoch": 60,
        "room": true
       }
      ]
     },
     "result": "valid",
     "expected": {
      "price": 0,
      "quota_index": 0
     }
    },
    {
     "tcId": 12,
     "comment": "a full quota",
     "flags": [
      "Quota"
     ],
     "sections": [
      "7"
     ],
     "inputs": {
      "base": 2100,
      "attests": [
       {
        "scheme": "httpauth:DPoP",
        "effect": "quota",
        "verified": true,
        "class": "A",
        "value": 5,
        "epoch": 60,
        "room": false
       }
      ]
     },
     "result": "valid",
     "expected": {
      "price": 2100,
      "quota_index": null
     }
    },
    {
     "tcId": 13,
     "comment": "a quota after a waive is not used",
     "flags": [
      "Quota"
     ],
     "sections": [
      "7"
     ],
     "inputs": {
      "base": 2100,
      "attests": [
       {
        "scheme": "httpauth:DPoP",
        "effect": "waive",
        "verified": true,
        "class": "A"
       },
       {
        "scheme": "nip:98",
        "effect": "quota",
        "verified": true,
        "class": "A",
        "value": 5,
        "epoch": 60,
        "room": true
       }
      ]
     },
     "result": "valid",
     "expected": {
      "price": 0,
      "quota_index": null
     }
    },
    {
     "tcId": 14,
     "comment": "first quota full, second with room: the second is used",
     "flags": [
      "Quota"
     ],
     "sections": [
      "7"
     ],
     "inputs": {
      "base": 2100,
      "attests": [
       {
        "scheme": "httpauth:DPoP",
        "effect": "quota",
        "verified": true,
        "class": "A",
        "value": 5,
        "epoch": 60,
        "room": false
       },
       {
        "scheme": "nip:98",
        "effect": "quota",
        "verified": true,
        "class": "A",
        "value": 5,
        "epoch": 60,
        "room": true
       }
      ]
     },
     "result": "valid",
     "expected": {
      "price": 0,
      "quota_index": 1
     }
    },
    {
     "tcId": 15,
     "comment": "a quota that did not verify is skipped",
     "flags": [
      "Quota"
     ],
     "sections": [
      "7"
     ],